{
  "name": "frontier-agent-skills",
  "owner": {
    "name": "frontier-agent-skills",
    "url": "https://github.com/frontier-agent-skills"
  },
  "metadata": {
    "description": "Vendor-neutral Agent Skills and plugins for enterprise platforms, with acceptance criteria and credential-free tests for every skill.",
    "version": "1.0.0",
    "pluginRoot": "./plugins"
  },
  "plugins": [
    {
      "name": "microsoft-fabric",
      "source": "./plugins/microsoft-fabric",
      "description": "Skills for data engineering in Microsoft Fabric: incremental, idempotent loads into Lakehouse Delta tables from notebooks, with secrets from Azure Key Vault and routine table maintenance. Bundles the read-only Microsoft Learn MCP server for current documentation.",
      "version": "0.1.0",
      "author": {
        "name": "Frontier Agent Skills and Plugins contributors",
        "url": "https://github.com/frontier-agent-skills/frontier-agent-skills-plugins"
      },
      "homepage": "https://github.com/frontier-agent-skills/frontier-agent-skills-plugins/tree/main/plugins/microsoft-fabric",
      "repository": "https://github.com/frontier-agent-skills/frontier-agent-skills-plugins",
      "license": "MIT",
      "keywords": [
        "microsoft",
        "fabric",
        "lakehouse",
        "delta-lake",
        "pyspark",
        "notebooks",
        "onelake",
        "data-engineering"
      ],
      "category": "data-engineering",
      "skills": [
        "./skills/"
      ]
    },
    {
      "name": "salesforce-platform",
      "source": "./plugins/salesforce-platform",
      "description": "Skills for Salesforce Platform development with Apex: bulk-safe trigger handlers, recursion control, user-mode data access, and tests that cover full 200-record trigger batches.",
      "version": "0.1.0",
      "author": {
        "name": "Frontier Agent Skills and Plugins contributors",
        "url": "https://github.com/frontier-agent-skills/frontier-agent-skills-plugins"
      },
      "homepage": "https://github.com/frontier-agent-skills/frontier-agent-skills-plugins/tree/main/plugins/salesforce-platform",
      "repository": "https://github.com/frontier-agent-skills/frontier-agent-skills-plugins",
      "license": "MIT",
      "keywords": [
        "salesforce",
        "apex",
        "triggers",
        "soql",
        "governor-limits",
        "unit-testing",
        "sfdx"
      ],
      "category": "development",
      "skills": [
        "./skills/"
      ]
    },
    {
      "name": "sap-abap",
      "source": "./plugins/sap-abap",
      "description": "Skills for SAP ABAP development across customer-managed and cloud systems: Standard ABAP on SAP ECC 6.0, SAP NetWeaver AS ABAP, and SAP S/4HANA (on premises or on Azure, AWS, or Google Cloud VMs), enhancements and integration, plus ABAP Cloud with RAP and clean core assessments.",
      "version": "0.2.0",
      "author": {
        "name": "Frontier Agent Skills and Plugins contributors",
        "url": "https://github.com/frontier-agent-skills/frontier-agent-skills-plugins"
      },
      "homepage": "https://github.com/frontier-agent-skills/frontier-agent-skills-plugins/tree/main/plugins/sap-abap",
      "repository": "https://github.com/frontier-agent-skills/frontier-agent-skills-plugins",
      "license": "MIT",
      "keywords": [
        "sap",
        "abap",
        "ecc",
        "netweaver",
        "s4hana",
        "abap-cloud",
        "rap",
        "enhancements",
        "idoc",
        "odata",
        "clean-core"
      ],
      "category": "development",
      "skills": [
        "./skills/"
      ]
    }
  ]
}
